file,descriptionEn,descriptionRu,descriptionUa
fulcrum_40.jpg,"""Under the dome"" The dome protects and hides from prying eyes everything that is so difficult for us to show to this world. If you felt safe at the sight of this dome, then you probably feel an oppressive sense of loneliness and feel isolated. Let these difficult emotions be in your life - perhaps it is through them that you will get to know the real you.","""Под куполом"" Купол оберегает и прячет от посторонних глаз все, что нам так сложно показать этому миру. Если при виде этого купола Ты почувствовала безопасность, то, вероятно, испытываешь гнетущее чувство одиночества и ощущаешь себя изолированной. Позволь этим непростым эмоциям быть в Твоей жизни — возможно, именно через них Ты познакомишься с собой настоящей.","""Під куполом"" Купол оберігає і ховає від сторонніх очей все, що нам так складно показати цьому світу. Якщо побачивши цей купол Ти відчула безпеку, то, ймовірно, відчуваєш гнітюче почуття самотності і відчуваєш себе ізольованою. Дозволь цим непростим емоціям бути у Твоєму житті — можливо, саме через них Ти познайомишся із собою справжнім."
fulcrum_41.jpg,"""Flamingo"" Your soul wants peace - it will heal it. Think about when you feel truly harmonious and whole? Fix these thoughts and boldly implement them in life.","""Фламинго"" Твоя душа хочет спокойствия — именно оно исцелит ее. Подумай, в какие моменты Ты чувствуешь себя по-настоящему гармонично и целостно? Зафиксируй эти мысли и смело реализуй их в жизни.","""Фламінго"" Твоя душа хоче спокою - саме воно зцілить її. Подумай, у які моменти Ти почуваєшся по-справжньому гармонійно та цілісно? Зафіксуй ці думки та сміливо реалізуй їх у житті."
fulcrum_42.jpg,"""Hugs"" Hugs always speak of warmth and intimacy with another person. This is an auspicious sign that symbolizes friendship, love, affection and deep feelings. Continue spiritual work on yourself, and your relationships with others will be filled with even greater harmony and mutual understanding.","""Объятия"" Объятия всегда говорят о теплоте и близости с другим человеком. Это благоприятный знак, который символизирует дружбу, любовь, привязанность и глубокие чувства. Продолжай духовную работу над собой, и Твои отношения с окружающими наполнятся ещё большей гармонией и взаимопониманием.","""Обійми"" Обійми завжди говорять про теплоту і близькість з іншою людиною. Це сприятливий знак, який символізує дружбу, кохання, прихильність та глибокі почуття. Продовжуй духовну роботу над собою, і Твої стосунки з оточуючими наповняться ще більшою гармонією та порозумінням."
fulcrum_43.jpg,"""The Book"" Perhaps life is teaching You a valuable lesson right now. Treat it with gratitude, because you can get much more than you lose. The book is a sign of success. If you follow the flow of life, then soon you will have a promotion or a successful purchase. Ask yourself: How can I speed up this process?","""Книга"" Возможно, прямо сейчас жизнь преподносит Тебе ценный урок. Отнесись к нему с благодарностью, потому что Ты можешь получить гораздо больше, чем потеряешь. Книга — знак успеха. Если следовать течению жизни, то в скором времени у Тебя случится повышение в должности или удачная покупка. Спроси себя: как я могу ускорить этот процесс?","""Книга"" Можливо, прямо зараз життя дає Тобі цінний урок. Постався до нього з вдячністю, тому що Ти можеш отримати набагато більше, ніж втратиш. Книга – знак успіху. Якщо слідувати перебігу життя, то незабаром у Тебе станеться підвищення на посаді чи вдала покупка. Запитай себе: як я можу прискорити цей процес?"
fulcrum_44.jpg,"""Zen"" For the one who comprehended happiness, being alone, there are no problems and difficulties - only opportunities. The girl sitting in the lotus position invites you to mentally disconnect from external experiences and meet with the secrets of the inner Universe.","""Дзен"" Для того, кто постиг счастье, находясь в одиночестве, не существует проблем и сложностей — только возможности. Девушка, сидящая в позе лотоса, призывает Тебя мысленно отключиться от внешних переживаний и встретиться с тайнами внутренней Вселенной.","""Дзен"" Для того, хто спіткав щастя, перебуваючи на самоті, не існує проблем і складнощів - тільки можливості. Дівчина, що сидить у позі лотоса, закликає Тебе подумки відключитися від зовнішніх переживань і зустрітися з таємницями внутрішнього Всесвіту."
